{
  "source_id": "noaa",
  "name": "NOAA Climate Data API",
  "kind": "api",
  "sectors": ["environment", "physics"],
  "subsectors": ["climate", "weather", "oceanography"],
  "data_types": ["tabular", "time_series", "geospatial"],
  "geo_coverage": {
    "scope": "global",
    "levels": ["global", "point", "polygon"],
    "crs": "EPSG:4326"
  },
  "time_coverage": {
    "start": "1850",
    "end": "present"
  },
  "variables_offered": [],
  "endpoints": [
    {
      "id": "data",
      "path": "/api/data",
      "method": "GET",
      "supports": {
        "time": true,
        "geo": true,
        "pagination": true
      }
    }
  ],
  "license": {
    "name": "Public Domain",
    "url": "https://www.noaa.gov/disclaimer",
    "commercial_use": true,
    "attribution_required": false
  },
  "authority": {
    "level": 5,
    "publisher": "National Oceanic and Atmospheric Administration"
  },
  "reliability": {
    "uptime_score": 0.99,
    "rate_limit_per_min": 1000
  }
}
