{
  "source_id": "nasa",
  "name": "NASA Open Data Portal",
  "kind": "api",
  "sectors": ["physics", "environment"],
  "subsectors": ["space", "climate", "earth_science"],
  "data_types": ["tabular", "time_series", "geospatial", "hybrid"],
  "geo_coverage": {
    "scope": "global",
    "levels": ["global", "point", "polygon"],
    "crs": "EPSG:4326"
  },
  "time_coverage": {
    "start": "1958",
    "end": "present"
  },
  "variables_offered": [],
  "endpoints": [
    {
      "id": "data",
      "path": "/api/data",
      "method": "GET",
      "supports": {
        "time": true,
        "geo": true,
        "pagination": true
      }
    }
  ],
  "license": {
    "name": "NASA Open Data Agreement",
    "url": "https://data.nasa.gov/story/s/nasa-open-data-agreement/",
    "commercial_use": true,
    "attribution_required": true
  },
  "authority": {
    "level": 5,
    "publisher": "National Aeronautics and Space Administration"
  },
  "reliability": {
    "uptime_score": 0.99,
    "rate_limit_per_min": 1000
  }
}
