{
  "source_id": "wmo",
  "name": "World Meteorological Organization",
  "kind": "api",
  "sectors": ["environment", "physics"],
  "subsectors": ["weather", "climate", "meteorology"],
  "data_types": ["tabular", "time_series", "geospatial"],
  "geo_coverage": {
    "scope": "global",
    "levels": ["global", "point", "polygon"],
    "crs": "EPSG:4326"
  },
  "time_coverage": {
    "start": "1850",
    "end": "present"
  },
  "variables_offered": [],
  "endpoints": [
    {
      "id": "data",
      "path": "/data",
      "method": "GET",
      "supports": {
        "time": true,
        "geo": true,
        "pagination": true
      }
    }
  ],
  "license": {
    "name": "WMO Data Policy",
    "url": "https://public.wmo.int/en/our-mandate/what-we-do/data-policy",
    "commercial_use": true,
    "attribution_required": true
  },
  "authority": {
    "level": 5,
    "publisher": "World Meteorological Organization"
  },
  "reliability": {
    "uptime_score": 0.99,
    "rate_limit_per_min": 100
  }
}
