{
  "source_id": "copernicus",
  "name": "Copernicus Climate Data Store",
  "kind": "api",
  "sectors": ["environment", "physics"],
  "subsectors": ["climate", "earth_observation"],
  "data_types": ["tabular", "time_series", "geospatial"],
  "geo_coverage": {
    "scope": "global",
    "levels": ["global", "point", "polygon"],
    "crs": "EPSG:4326"
  },
  "time_coverage": {
    "start": "1979",
    "end": "present"
  },
  "variables_offered": [],
  "endpoints": [
    {
      "id": "cds",
      "path": "/api/v2",
      "method": "POST",
      "supports": {
        "time": true,
        "geo": true,
        "pagination": false
      }
    }
  ],
  "license": {
    "name": "Copernicus License",
    "url": "https://cds.climate.copernicus.eu/terms-of-use",
    "commercial_use": true,
    "attribution_required": true
  },
  "authority": {
    "level": 5,
    "publisher": "European Commission - Copernicus"
  },
  "reliability": {
    "uptime_score": 0.98,
    "rate_limit_per_min": 10
  }
}
